Date,Year,Type,Country,State,Location,Activity,Sex,Age,Fatal Y/N,Time,Source,Fatal,Activity_Categorized
14-Mar-2000,2000,Unprovoked,Australia,New South Wales,"Mcmasters Beach, Central Coast",surfing,M,28,N,19h30,"Sydney Morning Herald, 3/16/2000 ",0,surfing
10-Mar-2000,2000,Watercraft,Australia,New South Wales,Parramatta River,rowing,,28,N,P.M.,"Sydney Morning Herald, ",0,Other
09-Mar-2000,2000,Watercraft,Australia,New South Wales,Parramatta River,rowing,,28,N,,Sydney Morning Herald,0,Other
02-Mar-2000,2000,Unprovoked,Australia,New South Wales,"Taronga Wharf, Athol Bay, Sydney Harbor",swimming,M,28,N,,Sydney Morning Herald,0,swimming
Mar-2000,2000,Unprovoked,United States,Louisiana,Midnight Lump (38 Miles Offshore),spearfishing,M,39,N,16h00,"R. Collier, GSAF",0,fishing
21-Feb-2000,2000,Unprovoked,United States,Florida,"Riviera Beach, Palm Beach County",,M,27,N,Afternoon,"The Palm Beach Post, 2/22/2000",0,Unknown
19-Feb-2000,2000,Unprovoked,South Africa,Western Cape Province,Struis Bay,body surfing,M,28,N,14h00,"C. Creswell, GSAF",0,surfing
14-Feb-2000,2000,Provoked,United Kingdom,Worcestershire,The Fountain Pub In Tenbury Wells,feeding prawns to captive sharks,M,28,N,,"The Sun (London), 2/17/2000",0,Other
03-Feb-2000,2000,Unprovoked,New Zealand,South Island,Oreti Beach (Reported As The 4Th Person Bitten In Nz In 2000),surfing,M,12,N,,"Waikato Times; Southland Times, 10/23/1999, p.1",0,surfing
01-Feb-2000,2000,Unprovoked,Australia,South Australia,"Point Sinclair, Cactus Beach Near Penong",surfing,M,26,N,,"T. Peake, GSAF",0,surfing
Reported 28-Jan-2000,2000,Watercraft,Reunion,nan,Saint Pierre,canoe with 3 men onboard sank,M,28,Y,,B.L. du Vendre,1,boarding
05-Jan-2000,2000,Unprovoked,Thailand,Phang Nga Province,Phang Nga Island,diving,M,35,Y,,A. Xuereb,1,Other
2000,2000,Watercraft,United States,Florida,"Boca Grande, Lee County",fishing for tarpon,M,28,N,,"B. Stout, News-Press, 7/2/2005",0,fishing
31-Dec-1999,1999,Unprovoked,New Zealand,South Island,Oreti Beach,surfing,M,15,N,,"R.D. Weeks, GSAF; The Otago Daily Times, 1/2/2000",0,surfing
31-Dec-1999,1999,Unprovoked,New Zealand,South Island,Oreti Beach,swimming,F,13,N,,"R.D. Weeks, GSAF; The Otago Daily Times, 1/2/2000; Waikato Times, 2/5/2000",0,swimming
31-Dec-1999,1999,Unprovoked,New Zealand,South Island,Oreti Beach,bathing,F,12,N,,"R.D. Weeks, GSAF; The Otago Daily Times, 1/2/2000",0,swimming
26-Dec-1999,1999,Unprovoked,Brazil,Pernambuco,"Boa Viagem Beach, Recife",surfing,M,18,N,,"L. A. Pereira & J. Morris; JC, 12/27/1999",0,surfing
06-Dec-1999,1999,Invalid,Brazil,Rio De Janeiro,"Rio De Janeiro, Guanabara Bay",spearfishing,M,39,N,09h30,L. A. Pereira ,0,fishing
02-Dec-1999,1999,Unprovoked,United States,Florida,"Boynton Beach, Palm Beach County",surfing,M,35,N,12h30,"The Palm Beach Post,12/3/1999 ",0,surfing
30-Nov-1999,1999,Unprovoked,United States,Florida,"Palm Beach, Palm Beach County",surfing,M,19,N,15h30,"A. Brenneka, Shark Attack Survivors; The Palm Beach Post,12/3/1999 ",0,surfing
23-Nov-1999,1999,Unprovoked,United States,Hawaii,"Big Island Off Kona Village Resort, North Kona",swimming,F,51,N,17h20,"G. Kubota, Star Bulletin",0,swimming
15-Nov-1999,1999,Unprovoked,United States,California,"Waddell Reef, Santa Cruz County",surfing (sitting on his board),M,28,N,,"R. Collier, pp.166-167",0,surfing
13 -Nov-1999,1999,Unprovoked,South Africa,Kwazulu-Natal,Umtentweni,surfing,M,35,N,,"G. Cliff, NSB",0,surfing
06-Nov-1999,1999,Unprovoked,Brazil,Rio De Janeiro,"Rio De Janeiro, Guanabara Bay","spearfishing, but swimming at surface",M,39,N,10h30,O. Gadig,0,surfing
Nov-1999,1999,Unprovoked,Marshall Islands,Alinglaplap Atoll,Island J4H,swimming,M,12,N,,www.svcherokee.com/pages/ Ailingilaplap.htm,0,swimming
Nov-1999,1999,Unprovoked,Marshall Islands,Alinglaplap Atoll,Island J4H,swimming,M,12,N,,www.svcherokee.com/pages/ Ailingilaplap.htm,0,swimming
30-Oct-1999,1999,Unprovoked,United States,Florida,"Daytona Beach, Volusia County",body boarding,M,45,N,17h30,"S. Petersohn, GSAF",0,boarding
30-Oct-1999,1999,Unprovoked,United States,Florida,"Gulfstream Park Beach, Palm Beach County",body surfing,M,13,N,15h00,"C. Lambert, Palm Beach Post, 10/31/1999, p.3C",0,surfing
20-Oct-1999,1999,Unprovoked,United States,Florida,"Pet Den, Satellite Beach, Brevard County",surfing,M,28,N,Noon,W. Schauman,0,surfing
01-Oct-1999,1999,Unprovoked,United States,Hawaii,Old Kona Airport State Park,"surfing, lying on surfboard",M,16,N,18h30,Star Bulletin,0,surfing
29-Sep-1999,1999,Unprovoked,United States,Florida,"South Side Of Ponce De Leon Inlet, Volusia County",wading to shore after surfing,M,22,N,18h45,"S. Petersohn, GSAF",0,surfing
24-Sep-1999,1999,Watercraft,Italy,Adriatic Sea,San Benedetto,fishing,,28,N,,"Orlando Sentinel, 9/28/1999, p.A12",0,fishing
19-Sep-1999,1999,Watercraft,United States,California,"North Of Pidgeon Point, San Mateo County",kayaking,M,37,N,18h30,R. Collier,0,kayaking
Reported 16-Sep-1999,1999,Unprovoked,United States,Florida,"Cape Canaveral, Brevard County",wading,F,61,N,,"Evening News (Edinburgh, Scotland)",0,Other
10-Sep-1999,1999,Unprovoked,United States,South Carolina,"Isle Of Palms, Charleston County",wading,F,10,N,Afternoon,"C. Creswell, GSAF",0,Other
05-Sep-1999,1999,Unprovoked,United States,Florida,"Fort Pierce Inlet, St. Lucie County",surfing,M,13,N,,"Orlando Sentinel, 9/8/1999, p.D3; Allen, p.65",0,surfing
04-Sep-1999,1999,Provoked,United States,Florida,"World Typhoon Lagoon, Disney Water Park, Orange County",wading,M,7,N,,"K. Morelli, Tampa Tribune, 9/6/1999",0,Other
04-Sep-1999,1999,Unprovoked,United States,Florida,"Ponce Inlet, Volusia County",wading with surfboard,M,39,N,19h00,"S. Petersohn, GSAF; Daytona Beach News Journal, 9/5/1999, p.7B ",0,surfing
26-Aug-1999,1999,Unprovoked,United States,Florida,"Bethune Beach, South Of New Smyrna Beach, Volusia County",surfing,M,28,N,14h30,"S. Petersohn, GSAF; Orlando Sentinel,  8/27/1999, p.D3; Miami Herald, 8/28/1999",0,surfing
24-Aug-1999,1999,Unprovoked,United States,North Carolina,"Fort Fisher, New Hanover County",surfing,M,28,N,,"Wilmington Star, 8/25/1999, C. Creswell, GSAF",0,surfing
23-Aug-1999,1999,Unprovoked,Marshall Islands,Ralik Chain,Kwajalein Atoll,fishing,M,23,N,Morning,"Kwajalein Hourglass, 8/27/1999",0,fishing
21-Aug-1999,1999,Unprovoked,United States,Florida,"Ponce Inlet, Volusia County",surfing,M,17,N,18h40,"S. Petersohn, GSAF",0,surfing
16-Aug-1999,1999,Unprovoked,United States,South Carolina,"Grand Strand, Myrtle Beach, Horry County",lying prone in 2' of water,M,10,N,17h40,"Charlotte Observer, 8/18/1999, p.4C; J. Kennedy, ProQuest; Sun News (Myrtle Beach), 8/19/1999; Richmond Times Dispatch, 8/19/1999",0,Other
05-Aug-1999,1999,Unprovoked,United States,Florida,"New Smyrna Beach, Volusia County",body surfing,M,62,N,11h25,"S. Petersohn, Orlando Sentinel, 8/6/1999; M.I. Johnson, Daytona Beach News Journal, 8/6/1999, p.3C ",0,surfing
05-Aug-1999,1999,Unprovoked,Bahamas,Abaco Islands,Grand Cay,spearfishing & holding catch,M,35,N,17h00,"South Florida Sun-Sentinel, 8/7/1999, p.1A; Palm Beach Post, 8/7/1999",0,fishing
29-Jul-1999,1999,Unprovoked,South Africa,Western Cape Province,Kogebaai,surfing,M,42,N,14h00,"A. Gifford, GSAF",0,surfing
26-Jul-1999,1999,Unprovoked,United States,Florida,"Two Miles Off Key Colony Beach, Monroe County",swimming with dolphins,M,43,N,18h25,"M.  Lynch; Miami Herald, 7/28/1999 ",0,swimming
21-Jul-1999,1999,Unprovoked,United States,Hawaii,Honoli'I In Hilo (West Side Of Big Island),surfing,M,43,N,10h28,Star Bulletin,0,surfing
15-Jul-1999,1999,Unprovoked,South Africa,Western Cape Province,Buffels Bay (Near Knysna),boogie boarding,M,14,Y,11h15,"A. Gifford, GSAF",1,boarding
06-Jul-1999,1999,Unprovoked,United States,South Carolina,Charleston,,M,28,N,,Channel 9 News Charlotte,0,Unknown
04-Jul-1999,1999,Unprovoked,United States,Florida,"Pensacola  Beach, Escambia County",wading in school of baitfish,F,30,N,Afternoon,"Pensacola News Journal, 7/5/1999 ",0,fishing
03-Jul-1999,1999,Unprovoked,South Africa,Eastern Cape Province,"Cintsa East, East London",surfing,M,29,N,Morning,"A. Gifford, GSAF",0,surfing
19-Jun-1999,1999,Unprovoked,United States,Florida,"11 Miles Off Dog Island In The Gulf Of Mexico, Franklin County",adrift in a life jacket,M,20,N,,"Orlando Sentinel, 6/21/1999, p.B.3",0,Other
17-Jun-1999,1999,Unprovoked,United States,Florida,"South Of Ponce Inlet, Volusia County",surfing,M,21,N,09h15,"S. Petersohn, GSAF",0,surfing
12-Jun-1999,1999,Unprovoked,United States,Florida,"Atlantiic Beach, Duval County",swimming,M,41,N,13h15,"Florida Times-Union, 6/13/1999",0,swimming
09-Jun-1999,1999,Unprovoked,United States,Florida,"Atlantic Dunes Park, Delray Beach, Palm Beach County",splashing / wading,M,5,N,16h00,"Palm Beach Post, 6/10/1999",0,Other
29-May-1999,1999,Unprovoked,Australia,South Australia,"Hardwicke Bay, Yorke Peninsula",windsurfing,M,22,Y,14h30,J. Morris,1,surfing
01-May-1999,1999,Unprovoked,Brazil,Pernambuco,"Boa Viagem Beach, Recife",surfing,M,21,N,Afternoon,"P.M. Lopez, GSAF; O. Gadig; JC, 5/3/1999",0,surfing
22-Apr-1999,1999,Unprovoked,Mauritius,Grand Baie,Pointe Aux Canonniers,swimming,F,41,N,06h00,,0,swimming
11-Apr-1999,1999,Unprovoked,Reunion,L' Etang Salé-Les-Bains,Roche-Aux-Oiseaux,swimming after being swept into sea by a large wave,M,52,Y,10h30,G. Van Grevelynghe,1,swimming
01-Apr-1999,1999,Unprovoked,United States,Florida,"Hobe Sound Beach, Palm Beach County",surfing,M,14,N,,"Palm Beach Post, 4/1/1999",0,surfing
Reported 18-Mar-1999 ,1999,Unprovoked,New Zealand,South Island,Codfish Island (Whenua Hau) West Of Stewart Island,spearfishing & diving for paua,M,28,N,,"Southland Times, 3/18/1999",0,fishing
18-Mar-1999,1999,Provoked,Brazil,Rio Grande De Norte,Atol Das Rochas,scientific research (dr. sonny gruber's student),M,28,N,,"internet, expedition ",0,Other
18-Mar-1999,1999,Unprovoked,United States,Hawaii,"Olowalu Side Of Lahina, Maui","swimming, towing a kayak",F,29,Y,20h30,"L. Fujimoto; G. Kubota,  Star Bulletin",1,swimming
14-Mar-1999,1999,Unprovoked,New Caledonia,Loyalty Islands,Ouvea,spearfishing,M,28,N,Morning,"W. Leander; Les Nouvelles Caledoniennes, 3/15/1999",0,fishing
08-Mar-1999,1999,Unprovoked,United States,Hawaii,"Kealia Beach, Kaua'I",body surfing or body boarding,M,18,N,,G. Balazs,0,surfing
05-Mar-1999,1999,Unprovoked,United States,Hawaii,"Quarter Mile Offshore In Kaanapali, West Maui",swimming near pod of whales,F,29,N,10h45,"S. Waterman, GSAF; L. Fujimoto; G. Kubota,  Star Bulletin",0,swimming
26-Feb-1999,1999,Watercraft,United States,North Carolina,Frying Pan Shoals,cruising,,28,N,,"Wilmington Star, 2/26/1999, C. Creswell, GSAF",0,Other
23-Feb-1999,1999,Unprovoked,Australia,New South Wales,Scotts Head,surfing,M,35,N,Evening,"Daily Telegraph, 2/24/1999, p.3; Orlando Sentinel, 2/24/1999, p.A10",0,surfing
03-Feb-1999,1999,Unprovoked,United States,Florida,"Hobe Sound, Martin County",surfing,M,25,N,15h30,"The Palm Beach Post, 2/5/1999; St. Petersburg Times, 2/6/1999",0,surfing
29-Jan-1999,1999,Unprovoked,Mauritius,nan,Belle-Mare,spearfishing,M,47,N,,J.M. Langlois,0,fishing
 13-Jan-1999,1999,Unprovoked,South Africa,Eastern Cape Province,Bonza Beach,paddle skiing,M,28,N,,The Citizen,0,Other
01-Jan-1999,1999,Watercraft,New Zealand,North Island,"Papamoa, Near Tauranga, Bay Of Plenty",inflatable boat,,28,N,,"The Dominion, 1/8/1999, p.3I",0,Other
03-Jan-1999,1999,Unprovoked,Reunion,Saint-Leu,Pointe Au Sel,spearfishing,,28,Y,,G. Van Grevelynghe,1,fishing
1999,1999,Unprovoked,South Africa,Western Cape Province,"Hospital Rock, Dyers Island",spearfishing,M,30,N,12h00,V. Van der Merwe,0,fishing
24-Dec-1998,1998,Provoked,United States,Florida,"Ormond Beach, Volusia County",surfing,M,19,N,08h30,"S. Petersohn, GSAF; Daytona Beach News Journal, 1/1/1999, p.6C; 9",0,surfing
22-Dec-1998,1998,Unprovoked,Australia,South Australia,Middleton Beach,standing,F,21,N,15h30,"The Advertiser, 12/23/1998, p.3; Daily Telegraph, 12/23/1998, p.17",0,floating/standing
Reported 20-Dec-1998,1998,Unprovoked,South Africa,Eastern Cape Province,"King'S Beach, Port Elizabeth",surfing,M,18,N,17h00,"G. Cliff, NSB; Sunday Times, 12/20/1998 ",0,surfing
18-Dec-1998,1998,Unprovoked,South Africa,Eastern Cape Province,Kei River Mouth,splashing,M,14,N,,"Sunday Times, 12/20/1998",0,Other
15-Dec-1998,1998,Unprovoked,Australia,South Australia,Middleton Beach,surfing,F,21,N,Afternoon,"Animal Attack Files, 12/19/1998",0,surfing
21-Nov-1998,1998,Unprovoked,United States,Florida,"Ocean Beach, Jaycee Park, Vero Beach, Indian River County",swimming,M,9,Y,14h00,E. Ritter. GSAF,1,swimming
14-Nov-1998,1998,Unprovoked,United States,Florida,"New Smyrna Beach, Volusia County",surfing,M,14,N,08h45,"S. Petersohn, GSAF; D. Catron, Orlando Sentinel, 11/19/1998, p.D1; Daytona Beach News Journal, 11/15/1998, p.4C",0,surfing
11-Nov-1998,1998,Unprovoked,United States,Florida,"South Beach Park, Indian River County",walking,M,13,N,17h00,press report,0,Other
05-Nov-1998,1998,Unprovoked,United States,Oregon,Winchester Bay,surfing,M,32,N,,"R. Collier, pp.165-166",0,surfing
02-Nov-1998,1998,Provoked,Japan,Southern Japan,460 Miles Off Iwakuni,fishing for tuna,M,52,N,,"Deseret News, 11/3/1998, p.A7",0,fishing
02-Nov-1998,1998,Unprovoked,Brazil,Pernambuco,"Boa Viagem Beach, Recife",surfing,M,22,Y,Late afternoon,O. Gadig & A. Xureb,1,surfing
24-Oct-1998,1998,Unprovoked,United States,Florida,"Jupiter Beach, Palm Beach County",swimming,F,17,N,Afternoon,"Sun Sentinel. Fort Lauderdale, 10/25/1998, p.3B",0,swimming
18-Oct-1998,1998,Unprovoked,South Africa,Eastern Cape Province,Glengariff,surfing,M,30,N,,"East London Daily Dispatch, 10/20/1998",0,surfing
10-Oct-1998,1998,Unprovoked,United States,Florida,"Sebastian Inlet, Indian River County",surfing,M,28,N,,"Sarasota Herald-Tribune, 10/13/1998 ",0,surfing
04-Oct-1998,1998,Unprovoked,Brazil,Pernambuco,"Boa Viagem Beach, Recife",surfing,M,17,N,,"Folha de S.Paul, 6/10/1998",0,surfing
01-Oct-1998,1998,Unprovoked,Reunion,Saint-Benoît,nan,diving,,28,N,,G. Van Grevelynghe,0,Other
01-Oct-1998,1998,Unprovoked,United States,Florida,"New Smyrna Beach, Volusia County",,M,28,N,14h30,S. Petersohn,0,Unknown
27-Sep-1998,1998,Unprovoked,United States,Florida,"The Rocks, Hutchinson Island, Martin County",surfing,M,6,N,,"The Stuart (FL) News, 9/29/1998",0,surfing
22-Sep-1998,1998,Unprovoked,United States,Florida,"New Smyrna Beach, Volusia County",surfing,M,18,N,15h35,"S. Petersohn, GSAF",0,surfing
Reported 16-Sep-1998,1998,Unprovoked,South Africa,Eastern Cape Province,Kowie River,fishing / washing bait off hands,M,28,N,Dusk,"Daily Dispatch, 9/16/1998",0,fishing
14-Sep-1998,1998,Unprovoked,United States,Florida,"Stuart Beach, Martin County",surfing,M,28,N,,"P. Sheth, Fort Pierce Tribune, 9/15/1998",0,surfing
Sep-1998,1998,Provoked,Senegal,Cap Vert Peninsula,Yoff Island,spearfishing,M,25,N,,S. Trape,0,fishing
30-Aug-1998,1998,Unprovoked,United States,Florida,"Ponce Inlet, Volusia County",surfing,M,26,N,20h15,"S. Petersohn, GSAF",0,surfing
26-Aug-1998,1998,Unprovoked,United States,California,"Stinson Beach, Marin County",boogie boarding,M,16,N,14h16,"R. Collier, pp.163-164      ",0,boarding
Reported      23-Aug-1998,1998,Unprovoked,United States,Virginia,Virginia Beach,spearfishing,M,28,N,,Dan,0,fishing
15-Aug-1998,1998,Unprovoked,Bahamas,Berry Islands,Ambergris Cay,spearfishing,M,28,N,16h30,"E. Ritter, GSAF",0,fishing
13-Aug-1998,1998,Unprovoked,United States,Florida,"Ponce Inlet, Volusia County",body-boarding,M,11,N,,"A. Buttigieg, GSAF",0,boarding
12-Aug-1998,1998,Provoked,South Africa,Transvaal,"National Zoological Gardens Aquarium, Pretoria",moving a shark in a net,M,28,N,,"Daily Dispatch, 8/13/1998",0,Other
01-Aug-1998,1998,Unprovoked,South Africa,Western Cape Province,"Buffalo Bay, Near Knysna",surfing (or body boarding),M,19,N,,"Daily Record (Glasgow, Scotland), 8/3/1998",0,surfing
01-Aug-1998,1998,Unprovoked,South Africa,Western Cape Province,Pringle Bay,spearfishing,M,24,N,13h00,"Daily Record (Glasgow, Scotland), 8/3/1998",0,fishing
26-Jul-1998,1998,Unprovoked,Brazil,Pernambuco,"Boa Viagem, Recife",surfing,M,28,N,17h30,JCOnline,0,surfing
25-Jul-1998,1998,Unprovoked,United States,Florida,"New Smyrna Beach, Volusia County",surfing,M,13,N,P.M.,"S. Petersohn, GSAF; Orlando Sentinel, 7/24/1998 & 7/27/1998 ",0,surfing
06-Jul-1998,1998,Unprovoked,South Africa,Western Cape Province,Plettenberg Bay,wading,M,47,N,,"A. Gifford, GSAF",0,Other
11-Jul-1998,1998,Unprovoked,South Africa,Eastern Cape Province,St. Francis Bay,surfing,M,16,N,Morning,"East London Daily Dispatch, 7/13/1998",0,surfing
06-Jul-1998,1998,Unprovoked,South Africa,Western Cape Province,Plettenberg Bay,surfing,M,10,N,,"A. Gifford, GSAF",0,surfing
28-Jun-1998,1998,Unprovoked,Australia,South Australia,South Neptune Island,free diving for abalone,M,26,Y,14h00,R.W. Byard,1,diving
22-Jun-1998,1998,Unprovoked,South Africa,Eastern Cape Province,"Gonubie, 13 Km Northeast Of East London",body boarding,M,20,Y,09h55,"A. Gifford, GSAF",1,boarding
08-Jun-1998,1998,Unprovoked,United States,Florida,"Daytona Beach, Volusia County",surfing,M,18,N,18h00,"S. Petersohn, GSAF",0,surfing
05-Jun-1998,1998,Unprovoked,South Africa,Eastern Cape Province,Jeffrey'S Bay,surfing,M,28,N,,"A. Gifford, GSAF",0,surfing
30-May-1998,1998,Unprovoked,South Africa,Eastern Cape Province,Pollock Beach,surfing,M,17,N,,"A. Gifford, GSAF",0,surfing
29-May-1998,1998,Unprovoked,South Africa,Eastern Cape Province,Sardinia Bay Near Port Elizabeth,body boarding,M,15,N,2 hours after Opperman,"A. Gifford, GSAF",0,boarding
29-May-1998,1998,Unprovoked,South Africa,Eastern Cape Province,Jeffreys Bay,body boarding,M,16,N,Early afternoon,"A. Gifford, GSAF",0,boarding
25-May-1998,1998,Unprovoked,United States,Florida,"New Smyrna Beach, Volusia County",surfing,M,40,N,11h10,"S. Petersohn, GSAF; Orlando Sentinel, 5/26/1998, p.C.3; Daytona Beach News Journal, 5/26/1998, p.2D",0,surfing
16-May-1998,1998,Unprovoked,United States,Florida,"Pecks Lake, Martin County",swimming,F,14,N,14h30,"The Stuart (FL) News, 5/17/1998",0,swimming
16-May-1998,1998,Unprovoked,United States,Florida,"Walden Rocks, St. Lucie County",swimming / surfing,M,24,N,15h00,"The Stuart (FL) News, 5/17/1998",0,surfing
16-May-1998,1998,Unprovoked,South Africa,Western Cape Province,Keurbooms,body boarding,M,22,N,14h45,"A. Gifford, GSAF",0,boarding
26-Apr-1998,1998,Unprovoked,Mozambique,Gaza,"Bilene Bay, 180 Km North Of Maputo",towing rubber dinghy,F,35,Y,15h05,"A. Gifford, GSAF",1,Other
21-Apr-1998,1998,Unprovoked,United States,Oregon,Gleneden Beach,surfing (lying prone on his board),M,50,N,09h30 ,"R. Collier, pp.161-163",0,surfing
17-Apr-1998,1998,Provoked,United States,Florida,"Marathon, Monroe County",scuba diving,M,16,N,,"CNN; Orlando Sentinel, 4/18/1998, p.D7;   Tallahassee Democrat, 4/19/1998",0,diving
01-Apr-1998,1998,Unprovoked,Brazil,Pernambuco,"Boa Viagem, Recife",swimming,M,28,Y,,"JC, 4/2/1998",1,swimming
Apr-1998,1998,Unprovoked,New Caledonia,nan,Île De Sable,,,28,N,,W. Leander,0,Unknown
31-Mar-1998,1998,Unprovoked,United States,Florida,"Jensen Beach Park, Martin County",swimming,M,40,N,15h30,"The Stuart (FL) News, 4/1/1998",0,swimming
15-Mar-1998,1998,Unprovoked,South Africa,Western Cape Province,Saldanha Bay,snorkeling – hunting crayfish and abalone,M,33,N,17h30,C. Maxwell,0,snorkeling
08-Mar-1998,1998,Unprovoked,United States,Florida,"Loggerhead Park, Juno Beach, Palm Beach County",swimming or paddle boarding,M,32,N,Morning,"Jupiter Courier, 3/11/1998",0,swimming
23-Feb-1998,1998,Unprovoked,United States,Florida,"Jensen Beach, Martin County",swimming,M,28,N,09h35,"Palm Beach Post, 2/24/1998",0,swimming
Jan-1998,1998,Unprovoked,New Caledonia,South Province,L'Anse-Vata,windsurfing,M,28,N,,"W. Leander, Les Nouvelles Caledoniennes, 1/301998",0,surfing
25-Jan-1998,1998,Unprovoked,Reunion,Grand'Anse,nan,bathing,M,28,Y,Mid afternoon,G. Van Grevelynghe,1,swimming
25-Jan-1998,1998,Unprovoked,South Africa,Eastern Cape Province,East London,surfing,M,21,N,,"A. Gifford, GSAF",0,surfing
17-Jan-1998,1998,Unprovoked,Australia,South Australia,Middleton Beach,surfing,M,28,N,Afternoon,"Sunday Mail (QLD), 1/18/1998, p.22; Hobart Mercury, 1/19/1998, p.41",0,surfing
14-Jan-1998,1998,Unprovoked,Mozambique,Maputo Province,Ponta Do Ouro,surfing,M,23,N,13h15,"A. Gifford, GSAF ",0,surfing
1998,1998,Unprovoked,South Africa,Eastern Cape Province,Hole-In-The Wall,surfing,M,28,Y,,BL Meel / B. Myatt,1,surfing
1998,1998,Unprovoked,Reunion,Beaufonds,nan,diving,,28,Y,,G. Van Grevelynghe,1,Other
1998 ,1998,Unprovoked,United States,Virginia,"Wreck Of The Navy Barge, 22 Miles Se Of Rudee",spearfishing on scuba & transferring fish onto a stringer,M,28,N,,"J. Musick,",0,fishing
28-Dec-1997,1997,Unprovoked,South Africa,Western Cape Province,"Pringle Bay, 44 Miles Southeast Of Cape Town",spearfishing,M,39,Y,14h00,"A. Gifford, GSAF",1,fishing
28-Dec-1997,1997,Unprovoked,South Africa,Eastern Cape Province,St. Francis Bay,sitting on surfboard,M,28,N,,"A. Gifford, GSAF",0,surfing
25-Dec-1997,1997,Unprovoked,United States,Florida,"Hollywood Beach, Broward County",swimming,M,8,N,,"Orlando Sentinel, 12/27/1997, p.D.3; Globe Newspaper Company",0,swimming
09-Nov-1997,1997,Unprovoked,Australia,Western Australia,Albany,scuba diving (submerged riding a scooter),M,42,N,Morning,"Daily Telegraph, 11/12/1997, p.5",0,diving
Reported 05-Nov-1997,1997,Unprovoked,United States,Florida,nan,swimming,M,32,N,Mid morning,"The Mirror (London), 11/5/1997",0,swimming
28-Oct-1997,1997,Unprovoked,Australia,Western Australia,"Cottesloe Beach, Perth",surf-skiing,M,51,N,,"Reuters Limited, et al",0,surfing
28-Oct-1997,1997,Unprovoked,United States,Hawaii,"Waiokapua Bay/Majors Bay, Brennecke Beach, Poipu, Kaua'I Island",body boarding or surfing,M,19,N,07h20,"Yahoo News Canada, 8/16/2012",0,surfing
24-Oct-1997,1997,Unprovoked,United States,Florida,"North Jetty, Fort Pierce Inlet State Park, St. Lucie County",surfing,M,23,N,17h15,"Fort Pierce News,  10/25/1997 & 10/31/1997",0,surfing
21-Oct-1997,1997,Unprovoked,United States,Florida,"North Jetty, Fort Pierce Inlet State Park, St. Lucie County",surfing,M,12,N,18h00,"Fort Pierce News,  10/24/1997, p.A2",0,surfing
Reported 11-Oct-1997,1997,Watercraft,South Africa,Eastern Cape Province,Off Port Alfred,fishingat,,28,N,,"Daily Dispatch, 10/11/1997",0,fishing
04-Oct-1997,1997,Unprovoked,United States,Florida,"Daytona Beach, Volusia County",swimming,F,14,N,08h30,"S. Petersohn, GSAF; Orlando Sentinel, 10/5/1997, p.B.3; J. Bozzo; Daytona Beach News Journal, 10/6/1997, p.3D ",0,swimming
16-Sep-1997,1997,Unprovoked,Brazil,Pernambuco,"Boa Viagem, Recife",swimming,M,20,Y,,JCOnline,1,swimming
09-Sep-1997,1997,Unprovoked,United States,Florida,Volusia County,surfing,M,12,N,17h15,"S. Petersohn, GSAF",0,surfing
08-Sep-1997,1997,Unprovoked,United States,Florida,"New Smyrna Beach, Volusia County",surfing,,17,N,Evening,"Daytona News-Journal, 9/9/1997",0,surfing
06-Sep-1997,1997,Unprovoked,United States,Florida,"New Smyrna Beach, Volusia County",surfing,M,20,N,15h20,"S. Petersohn, GSAF",0,surfing
30-Aug-1997,1997,Unprovoked,United States,Florida,"New Smyrna Beach, Volusia County",surfing,M,18,N,13h00,"S. Petersohn, GSAF",0,surfing
27-Aug-1997,1997,Unprovoked,United States,Florida,"New Smyrna Beach, Volusia County",walking / surfing,M,22,N,11h20,"S. Petersohn, GSAF",0,surfing
24-Aug-1997,1997,Unprovoked,United States,California,"Clam Beach, Near Eureka, Humboldt County",surfing (sitting on his board),M,29,N,12h30,"R. Collier, pp.159-160",0,surfing
14-Aug-1997,1997,Unprovoked,Mexico,Quintana Roo,"Santa Rosa, Cozumel",scuba diving,M,33,Y,,"Charlotte Observer, 8/22/2997, p.7C & 8C; York Observer, 8/22/1997, p.2Y; UWSports.com",1,diving
11-Aug-1997,1997,Unprovoked,United States,Florida,"New Smyrna Beach, Volusia County",floating on raft,F,12,N,14h16,"S. Petersohn, GSAF",0,floating/standing
11-Aug-1997,1997,Unprovoked,Egypt,Red Sea,Safaga,fishing,M,17,N,,"Middle East Times, 8/15/1997",0,fishing
11-Aug-1997,1997,Unprovoked,Egypt,Red Sea,Safaga,fishing,M,16,Y,,"Middle East Times, 8/15/1997",1,fishing
10-Aug-1997,1997,Unprovoked,United States,Florida,"New Smyrna Beach, Volusia County",boogie boarding,M,17,N,11h48,"S. Petersohn, GSAF",0,boarding
09-Aug-1997,1997,Unprovoked,United States,Florida,"New Smyrna Beach, Volusia County",surfing,M,28,N,17h15,"S. Petersohn, GSAF",0,surfing
05-Aug-1997,1997,Unprovoked,United States,Texas,"East Beach, Galveston",wading,F,10,N,,"Austin American Statesman, 8/7/1997, p.C8",0,Other
04-Aug-1997,1997,Unprovoked,United States,Florida,"Carysfort Lighthouse, Key Largo, Monroe County",wade-fishing,M,28,N,,"Miami Herald, 8/29/1997",0,fishing
02-Aug-1997,1997,Unprovoked,United States,Florida,"New Smyrna Beach, Volusia County",body surfing,M,17,N,15h45,"S. Petersohn, GSAF; D. Catron, Orlando Sentinel, 8/3/1997, B3",0,surfing
02-Aug-1997,1997,Unprovoked,United States,Florida,"New Smyrna Beach, Volusia County",wading / surfing,M,19,N,09h15,"S. Petersohn, GSAF; D. Catron, Orlando Sentinel, 8/3/1997, B3",0,surfing
27-Jul-1997,1997,Unprovoked,Australia,Queensland,"Pincushion, North Of Maroochydore Beach",surfing,M,19,N,14h25,"Courier-Mail, 7/28/1997, p.5",0,surfing
21-Jul-1997,1997,Unprovoked,South Africa,Eastern Cape Province,"Breezy Point, Ntlonyana",surfing,M,25,Y,12h45,"A. Gifford, GSAF, G. Cliff, NSB",1,surfing
17-Jul-1997,1997,Unprovoked,Brazil,Pernambuco,"Boa Viagem, Recife",surfing,M,28,N,,JCOnline,0,surfing
14-Jul-1997,1997,Unprovoked,United States,South Carolina,"Myrtle Beach, Horry County",standing,M,50,N,Night,"Charlotte Observer, 7/17/1997, p.2C; C. Creswell, GSAF",0,floating/standing
12-Jul-1997,1997,Unprovoked,Other/Region,Miyako,Hirara,fishing for octopus,M,55,Y,,"Okinawa Weekly Times, 7/19/1997 editon; Ryukyu Shrimpo News (Japan)",1,fishing
 2-Jul-1997,1997,Unprovoked,Brazil,Pernambuco,Paiva,surfing,,28,N,,"D. Duarte; Globo, 7/2/1997",0,surfing
24-Jun-1997,1997,Unprovoked,United States,Hawaii,"Sunset Beach, Oahu",spearfishing / night diving,M,28,N,23h00,Hawaii Department of Land and Natural Resources,0,fishing
